{
  "$schema": "https://json-schema.org/draft/2020-12/schema",
  "$id": "https://climateguard.example/schemas/briefing-response.schema.json",
  "title": "Preparedness briefing response",
  "type": "object",
  "additionalProperties": false,
  "required": ["contractVersion", "requestId", "title", "situation", "actions", "confidence", "requiresHumanReview", "citations", "generatedAt"],
  "properties": {
    "contractVersion": { "const": "1.0" },
    "requestId": { "type": "string", "minLength": 1 },
    "title": { "type": "string", "minLength": 1 },
    "situation": { "type": "string", "minLength": 1 },
    "actions": {
      "type": "array",
      "minItems": 1,
      "maxItems": 7,
      "items": {
        "type": "object",
        "additionalProperties": false,
        "required": ["priority", "action", "rationale"],
        "properties": {
          "priority": { "type": "integer", "minimum": 1, "maximum": 7 },
          "action": { "type": "string", "minLength": 1 },
          "rationale": { "type": "string", "minLength": 1 }
        }
      }
    },
    "confidence": { "type": "string", "enum": ["low", "medium", "high"] },
    "requiresHumanReview": { "const": true },
    "citations": {
      "type": "array",
      "minItems": 1,
      "items": {
        "type": "object",
        "additionalProperties": false,
        "required": ["title", "url"],
        "properties": {
          "title": { "type": "string" },
          "url": { "type": "string", "format": "uri" }
        }
      }
    },
    "generatedAt": { "type": "string", "format": "date-time" },
    "disclaimer": { "type": "string" }
  }
}
